{
  "version": "1.0",
  "audio": {
    "asset_id": "audio_001",
    "bpm": 120.0
  },
  "defaults": {
    "beats_per_cut": 8,
    "transition": {
      "type": "crossfade",
      "duration_ms": 300
    }
  },
  "timeline": [
    {
      "asset_id": "img_001",
      "type": "image",
      "duration": {
        "mode": "beats",
        "count": 4
      },
      "effect": "pan_left"
    },
    {
      "asset_id": "img_002",
      "type": "image",
      "duration": {
        "mode": "beats",
        "count": 16
      }
    },
    {
      "asset_id": "img_003",
      "type": "image",
      "duration": {
        "mode": "ms",
        "value": 3000
      }
    }
  ],
  "repeat": {
    "mode": "repeat_last"
  }
}
