{
  "version": "1.0",
  "audio": {
    "asset_id": "audio_001",
    "bpm": 128.0,
    "start_offset_ms": 500,
    "trim_end_ms": 1000
  },
  "defaults": {
    "beats_per_cut": 8,
    "transition": {
      "type": "crossfade",
      "duration_ms": 500
    }
  },
  "timeline": [
    {
      "asset_id": "img_001",
      "type": "image",
      "transition_in": {
        "type": "cut"
      }
    },
    {
      "asset_id": "vid_001",
      "type": "video",
      "duration": {
        "mode": "ms",
        "value": 16000
      },
      "source": {
        "in_ms": 5000,
        "out_ms": 21000
      }
    },
    {
      "asset_id": "vid_002",
      "type": "video",
      "duration": {
        "mode": "natural"
      },
      "source": {
        "in_ms": 0,
        "out_ms": 10000
      }
    }
  ],
  "repeat": {
    "mode": "stop",
    "fill_behavior": "black"
  }
}
